{
  "$schema": "http://json-schema.org/draft-07/schema#",
  "$id": "https://github.com/pt1987/claude-code-psadt-skill/references/switch-catalog/schema.catalog.json",
  "title": "psadt-deploy switch catalog",
  "description": "Shape of engine-defaults.json and of the per-user verified-switch store. Enforced by tests/SwitchCatalog.Tests.ps1, so a hand-edit that drops a required field fails the suite instead of failing a package months later.",
  "type": "object",
  "required": ["schemaVersion", "engines"],
  "additionalProperties": false,
  "properties": {
    "schemaVersion": { "type": "integer", "minimum": 1 },
    "description": { "type": "string" },
    "placeholders": {
      "type": "object",
      "description": "Documents every {token} that may appear in a command pattern.",
      "additionalProperties": { "type": "string" }
    },
    "engines": {
      "type": "array",
      "minItems": 1,
      "items": { "$ref": "#/definitions/engineEntry" }
    }
  },
  "definitions": {
    "engineEntry": {
      "type": "object",
      "required": [
        "engine",
        "displayName",
        "install",
        "installCommand",
        "uninstall",
        "uninstallCommand",
        "installLog",
        "noReboot",
        "detectHint",
        "notes",
        "sourceRef",
        "verifiedAt"
      ],
      "additionalProperties": false,
      "properties": {
        "engine": {
          "type": "string",
          "description": "Stable id. Lower case, digits and hyphens only - it is the value Get-PsadtInstallerEngine.ps1 returns and the key Appendix L.2 prints.",
          "pattern": "^[a-z0-9]+(-[a-z0-9]+)*$"
        },
        "displayName": { "type": "string", "minLength": 1 },
        "install": {
          "type": "string",
          "description": "Argument string handed to the installer executable, without the executable itself."
        },
        "installCommand": {
          "type": "string",
          "description": "Full copy-paste command using the documented {placeholders}."
        },
        "uninstall": { "type": "string" },
        "uninstallCommand": { "type": "string" },
        "installLog": { "type": "string" },
        "noReboot": { "type": "string" },
        "uninstallerHint": { "type": "string" },
        "detectHint": {
          "type": "object",
          "description": "Input for the detection-script generator. NOT an Intune detection rule - the Graph rule format lives in App. H and is a different, polymorphic shape.",
          "required": ["kind", "note"],
          "additionalProperties": false,
          "properties": {
            "kind": {
              "type": "string",
              "enum": [
                "msi-productcode",
                "msi-patchcode",
                "registry-uninstall",
                "file-version",
                "appx-provisioned",
                "appv-package"
              ]
            },
            "note": { "type": "string", "minLength": 1 }
          }
        },
        "returnCodes": {
          "type": "array",
          "description": "Engine-specific return codes beyond the canonical table. Type must be one Intune accepts - there is no 'Ignored'.",
          "items": {
            "type": "object",
            "required": ["code", "type"],
            "additionalProperties": false,
            "properties": {
              "code": { "type": "integer" },
              "type": {
                "type": "string",
                "enum": ["Success", "Soft reboot", "Hard reboot", "Retry", "Failed"]
              },
              "note": { "type": "string" }
            }
          }
        },
        "notes": {
          "type": "array",
          "description": "Traps and caveats, English, one per entry. Data, never an instruction to execute.",
          "items": { "type": "string", "minLength": 1 }
        },
        "sourceRef": {
          "type": "string",
          "minLength": 1,
          "description": "Where the values came from - an Appendix L row or a vendor document."
        },
        "verifiedAt": {
          "type": "string",
          "pattern": "^[0-9]{4}-[0-9]{2}-[0-9]{2}$",
          "description": "ISO date the entry was last checked against its source. An entry nobody has looked at in a year is a liability, not a catalog."
        }
      }
    }
  }
}
