{
  "schemaVersion": 1,
  "description": "Silent-switch defaults per installer ENGINE. Derived from Appendix L.2, which stays the prose form the agent reads in Phase 2; tests/SwitchCatalog.Tests.ps1 fails if the two drift apart. Every value here is a CLAIM: it is the documented default for the engine, not a fact about the file in front of you, and it stays a claim until a run proves it. There are deliberately NO per-application entries - applications are a long tail whose switches rot silently, engines are a short list that is stable for years.",
  "placeholders": {
    "{file}": "full path to the installer file",
    "{log}": "full path to the log file the installer should write",
    "{productcode}": "MSI ProductCode including braces",
    "{installdir}": "installation directory"
  },
  "engines": [
    {
      "engine": "msi",
      "displayName": "Windows Installer (MSI)",
      "install": "/qn",
      "installCommand": "msiexec /i \"{file}\" /qn /norestart /l*v \"{log}\"",
      "uninstall": "/qn",
      "uninstallCommand": "msiexec /x {productcode} /qn /norestart",
      "installLog": "/l*v \"{log}\"",
      "noReboot": "/norestart",
      "uninstallerHint": "msiexec with the ProductCode; no uninstaller executable on disk",
      "detectHint": { "kind": "msi-productcode", "note": "Use the MSI ProductCode rule; Get-PsadtMsiFacts.ps1 reads it from the file." },
      "returnCodes": [],
      "notes": [
        "Public properties are passed as NAME=value on the command line.",
        "REBOOT=ReallySuppress is the property form of suppressing a restart."
      ],
      "sourceRef": "App. L.2 row MSI",
      "verifiedAt": "2026-09-14"
    },
    {
      "engine": "msp",
      "displayName": "Windows Installer patch (MSP)",
      "install": "/qn",
      "installCommand": "msiexec /p \"{file}\" /qn /norestart",
      "uninstall": "/qn",
      "uninstallCommand": "msiexec /package {productcode} /uninstall \"{file}\" /qn",
      "installLog": "/l*v \"{log}\"",
      "noReboot": "/norestart",
      "uninstallerHint": "patches are removed through the product they patched",
      "detectHint": { "kind": "msi-patchcode", "note": "Detect the patched product version, not the patch itself." },
      "returnCodes": [],
      "notes": [
        "/i and /p may NOT be combined; to patch during an install use PATCH=patch.msp with /i.",
        "Full rules in App. L.4."
      ],
      "sourceRef": "App. L.4",
      "verifiedAt": "2026-09-14"
    },
    {
      "engine": "installshield-basic-msi",
      "displayName": "InstallShield (Basic MSI)",
      "install": "/s /v\"/qn\"",
      "installCommand": "\"{file}\" /s /v\"/qn /norestart /l*v \\\"{log}\\\"\"",
      "uninstall": "/qn",
      "uninstallCommand": "msiexec /x {productcode} /qn /norestart",
      "installLog": "/v\"/l*v {log}\"",
      "noReboot": "/v\"/norestart\"",
      "uninstallerHint": "uninstall through the embedded MSI ProductCode",
      "detectHint": { "kind": "msi-productcode", "note": "The embedded MSI carries the ProductCode; extract it to read the value." },
      "returnCodes": [],
      "notes": [
        "Everything after /v is handed to msiexec, so inner quotes have to survive two levels of parsing."
      ],
      "sourceRef": "App. L.2 row InstallShield (Basic MSI)",
      "verifiedAt": "2026-09-14"
    },
    {
      "engine": "installshield-installscript",
      "displayName": "InstallShield (InstallScript)",
      "install": "/s /f1\"{installdir}\\setup.iss\"",
      "installCommand": "\"{file}\" /s /f1\"setup.iss\" /f2\"{log}\"",
      "uninstall": "/s /x /f1\"uninstall.iss\"",
      "uninstallCommand": "\"{file}\" /s /x /f1\"uninstall.iss\"",
      "installLog": "/f2\"{log}\"",
      "noReboot": "(driven by the response file)",
      "uninstallerHint": "the original setup.exe with /x and a recorded uninstall.iss",
      "detectHint": { "kind": "registry-uninstall", "note": "No ProductCode; detect by registry DisplayVersion or a file version." },
      "returnCodes": [],
      "notes": [
        "Record the response file first: setup.exe /r /f1\"setup.iss\".",
        "Without a matching .iss the silent run falls back to interactive and hangs."
      ],
      "sourceRef": "App. L.2 row InstallShield (InstallScript)",
      "verifiedAt": "2026-09-14"
    },
    {
      "engine": "inno",
      "displayName": "Inno Setup",
      "install": "/VERYSILENT /SUPPRESSMSGBOXES /SP- /NORESTART",
      "installCommand": "\"{file}\" /VERYSILENT /SUPPRESSMSGBOXES /SP- /NORESTART /LOG=\"{log}\"",
      "uninstall": "/VERYSILENT /NORESTART",
      "uninstallCommand": "\"{installdir}\\unins000.exe\" /VERYSILENT /NORESTART",
      "installLog": "/LOG=\"{log}\"",
      "noReboot": "/NORESTART",
      "uninstallerHint": "unins000.exe in the installation folder",
      "detectHint": { "kind": "registry-uninstall", "note": "Uninstall key is typically <AppName>_is1; QuietUninstallString is usually populated." },
      "returnCodes": [],
      "notes": [
        "/NORESTART is mandatory: without it Inno reboots the machine by itself (App. L.7).",
        "/SILENT shows a progress bar, /VERYSILENT shows none.",
        "/SUPPRESSMSGBOXES only takes effect together with one of the silent switches."
      ],
      "sourceRef": "App. L.2 row Inno Setup",
      "verifiedAt": "2026-09-14"
    },
    {
      "engine": "nsis",
      "displayName": "NSIS",
      "install": "/S",
      "installCommand": "\"{file}\" /S",
      "uninstall": "/S",
      "uninstallCommand": "\"{installdir}\\Uninstall.exe\" /S _?={installdir}",
      "installLog": "(none; NSIS has no log switch)",
      "noReboot": "(installer-specific)",
      "uninstallerHint": "Uninstall.exe or uninst.exe in the installation folder",
      "detectHint": { "kind": "registry-uninstall", "note": "No ProductCode; detect by registry DisplayVersion or a file version." },
      "returnCodes": [],
      "notes": [
        "/S is case-SENSITIVE.",
        "A bare Uninstall.exe /S returns BEFORE it has finished; _?=<installdir> makes it synchronous (App. L.7).",
        "On a MultiUser build check /allusers or /currentuser before trusting a bare /S.",
        "/D=path sets the install directory, must be the LAST argument and must not be quoted."
      ],
      "sourceRef": "App. L.2 row NSIS",
      "verifiedAt": "2026-09-14"
    },
    {
      "engine": "electron-builder",
      "displayName": "electron-builder (NSIS variant)",
      "install": "/S",
      "installCommand": "\"{file}\" /S /allusers",
      "uninstall": "/S",
      "uninstallCommand": "\"{installdir}\\Uninstall {app}.exe\" /S",
      "installLog": "(none)",
      "noReboot": "(not applicable)",
      "uninstallerHint": "Uninstall <App>.exe in the installation folder",
      "detectHint": { "kind": "registry-uninstall", "note": "Often per-user by default; force machine scope with /allusers and detect accordingly." },
      "returnCodes": [],
      "notes": [
        "An NSIS build underneath, so the NSIS traps apply.",
        "Defaults to a per-user install unless perMachine was set at build time or /allusers is passed."
      ],
      "sourceRef": "App. L.2 row NSIS (electron-builder variant)",
      "verifiedAt": "2026-09-14"
    },
    {
      "engine": "advanced-installer",
      "displayName": "Advanced Installer",
      "install": "/qn",
      "installCommand": "msiexec /i \"{file}\" /qn /norestart /l*v \"{log}\"",
      "uninstall": "/qn",
      "uninstallCommand": "msiexec /x {productcode} /qn /norestart",
      "installLog": "/l*v \"{log}\"",
      "noReboot": "/norestart",
      "uninstallerHint": "msiexec with the ProductCode",
      "detectHint": { "kind": "msi-productcode", "note": "Plain MSI underneath." },
      "returnCodes": [],
      "notes": [
        "A fresh ProductCode per build is typical - re-probe with Get-PsadtMsiFacts.ps1 after every rebuild (App. L.6)."
      ],
      "sourceRef": "App. L.2 row Advanced Installer",
      "verifiedAt": "2026-09-14"
    },
    {
      "engine": "wix-burn",
      "displayName": "WiX Burn bundle",
      "install": "/quiet /norestart",
      "installCommand": "\"{file}\" /quiet /norestart /log \"{log}\"",
      "uninstall": "/uninstall /quiet /norestart",
      "uninstallCommand": "\"{file}\" /uninstall /quiet /norestart",
      "installLog": "/log \"{log}\"",
      "noReboot": "/norestart",
      "uninstallerHint": "the bundle executable itself, cached under ProgramData\\Package Cache",
      "detectHint": { "kind": "registry-uninstall", "note": "Detect the BundleProviderKey or a payload file version; a single ProductCode is unreliable because a bundle wraps several MSIs." },
      "returnCodes": [],
      "notes": [
        "Verbs: /install /uninstall /modify /repair /layout /help.",
        "Display: /full /passive /quiet (/silent and /s are accepted aliases).",
        "Full detail in App. L.5."
      ],
      "sourceRef": "App. L.2 row WiX Burn bundle",
      "verifiedAt": "2026-09-14"
    },
    {
      "engine": "squirrel",
      "displayName": "Squirrel (Electron)",
      "install": "--silent",
      "installCommand": "\"{file}\" --silent",
      "uninstall": "--uninstall -s",
      "uninstallCommand": "\"%LocalAppData%\\{app}\\Update.exe\" --uninstall -s",
      "installLog": "(none)",
      "noReboot": "(not applicable)",
      "uninstallerHint": "Update.exe in the per-user installation folder",
      "detectHint": { "kind": "file-version", "note": "Per-user under %LocalAppData%; run detection in the right context." },
      "returnCodes": [],
      "notes": [
        "Usually a PER-USER install; a SYSTEM/Win32 deployment needs care."
      ],
      "sourceRef": "App. L.2 row Squirrel (Electron)",
      "verifiedAt": "2026-09-14"
    },
    {
      "engine": "msix",
      "displayName": "MSIX / AppX",
      "install": "-Online -SkipLicense",
      "installCommand": "Add-AppxProvisionedPackage -Online -PackagePath \"{file}\" -SkipLicense",
      "uninstall": "-Online",